{
  "id": "onimusha-way-of-the-sword",
  "name": "Onimusha: Way of the Sword",
  "name_zh": "鬼武者 Way of the Sword",
  "platforms": [
    "steam",
    "pc"
  ],
  "tags": [
    "aaa",
    "action"
  ],
  "sources": [
    {
      "label": "Steam",
      "url": "https://store.steampowered.com/app/2638890/"
    }
  ],
  "steam_appid": 2638890,
  "stub": true,
  "watchlist": false,
  "note": "Catalog stub — Steam store link only; no invented scores",
  "as_of": "2026-09-27",
  "timezone": "Asia/Shanghai"
}
