{
  "id": "palworld",
  "name": "Palworld",
  "name_zh": "幻兽帕鲁",
  "platforms": [
    "steam",
    "pc",
    "xbox"
  ],
  "tags": [
    "survival",
    "open-world",
    "multiplayer"
  ],
  "sources": [
    {
      "label": "Steam",
      "url": "https://store.steampowered.com/app/1623730/"
    }
  ],
  "steam_appid": 1623730,
  "stub": true,
  "watchlist": false,
  "note": "Catalog stub — Steam store link only; no invented scores",
  "as_of": "2026-09-25",
  "timezone": "Asia/Shanghai"
}
