{
  "id": "factorio",
  "name": "Factorio",
  "name_zh": "异星工厂",
  "platforms": [
    "steam",
    "pc"
  ],
  "tags": [
    "indie",
    "sim",
    "factory"
  ],
  "sources": [
    {
      "label": "Steam",
      "url": "https://store.steampowered.com/app/427520/"
    }
  ],
  "steam_appid": 427520,
  "stub": true,
  "watchlist": false,
  "note": "Catalog stub — Steam store link only; no invented scores",
  "as_of": "2026-09-25",
  "timezone": "Asia/Shanghai"
}
