{
  "id": "metaphor-refantazio",
  "name": "Metaphor: ReFantazio",
  "name_zh": "暗喻幻想：ReFantazio",
  "platforms": [
    "steam",
    "pc"
  ],
  "tags": [
    "aaa",
    "rpg"
  ],
  "sources": [
    {
      "label": "Steam",
      "url": "https://store.steampowered.com/app/2679460/"
    }
  ],
  "steam_appid": 2679460,
  "stub": true,
  "watchlist": false,
  "note": "Catalog stub — Steam store link only; no invented scores",
  "as_of": "2026-09-27",
  "timezone": "Asia/Shanghai"
}
