{
  "id": "gears-of-war-e-day",
  "name": "Gears of War: E-Day",
  "platforms": [
    "steam",
    "pc"
  ],
  "tags": [
    "aaa",
    "shooter",
    "upcoming"
  ],
  "sources": [
    {
      "label": "Steam",
      "url": "https://store.steampowered.com/app/3010850/"
    }
  ],
  "steam_appid": 3010850,
  "stub": true,
  "watchlist": false,
  "note": "Catalog stub — Steam store link only; page lists the title as upcoming. No invented scores or dates.",
  "as_of": "2026-09-27",
  "timezone": "Asia/Shanghai"
}
