{
  "id": "the-witcher-3",
  "name": "The Witcher 3: Wild Hunt - Complete Edition",
  "name_zh": "巫师 3：狂猎 - 完全版",
  "platforms": [
    "steam",
    "pc"
  ],
  "tags": [
    "aaa",
    "rpg",
    "open-world"
  ],
  "sources": [
    {
      "label": "Steam",
      "url": "https://store.steampowered.com/app/292030/"
    }
  ],
  "steam_appid": 292030,
  "stub": true,
  "watchlist": false,
  "note": "Catalog stub — Steam store link only; no invented scores",
  "as_of": "2026-09-27",
  "timezone": "Asia/Shanghai"
}
