{
  "id": "the-blood-of-dawnwalker",
  "name": "The Blood of Dawnwalker",
  "name_zh": "黎明行者之血",
  "platforms": [
    "steam",
    "pc"
  ],
  "tags": [
    "aaa",
    "action",
    "rpg"
  ],
  "sources": [
    {
      "label": "Steam",
      "url": "https://store.steampowered.com/app/3751260/"
    }
  ],
  "steam_appid": 3751260,
  "stub": true,
  "watchlist": false,
  "note": "Catalog stub — Steam store link only; no invented scores",
  "as_of": "2026-09-27",
  "timezone": "Asia/Shanghai"
}
